{
  "tool": {
    "name": "10x402",
    "repo": "https://github.com/algonormative/10x402",
    "commit": "2a0f2fb628e4ccfaa335911316a39002bad85f37",
    "blobs": {
      "worker/lint.js": "38bb9a4055c1a53bb3082a2c4a9504afcfd61ff7",
      "worker/json-schema.js": "852ff5546384c03cf7f3251b372d804dad7a6ab0",
      "worker/envelope.js": "ca981a2038d5d566c9f595b0ee16d1b0b95f78de",
      "worker/positive-control.js": "5e816c0a9448733b12bc8fc4d9db26686dabf377",
      "test/fixtures/envelopes.mjs": "0c333e124ad665cdf053bbf0c843b08415531b36",
      "corpus/vocabulary.mjs": "ef61b617cbfe537cf9de56f75742c5a74f0ccb5b",
      "corpus/run-10x402.mjs": "7be82d608feeb7b3d408b06dd5f994ae6a6e9222",
      "corpus/client-probe.json": "8f80dc795b51f80fbae49172a13f62ecee7de1d3",
      "corpus/client-probe.lock.json": "c42b926aa770c49fa3e5e4d94eb18b5f40e2d174"
    }
  },
  "corpus_version": 3,
  "ran": "2026-08-20",
  "adapter": "corpus/run-10x402.mjs",
  "partial_evaluation": {
    "rules_held_back": [],
    "note": "the engine is a pure function over a recorded response; every check in the catalogue is applied to every fixture"
  },
  "results": [
    {
      "id": "calibration-spec-canonical-402",
      "dimensions": {
        "payment": {
          "verdict": "pass",
          "reason_tags": [],
          "observed_tags": [
            "envelope-absent"
          ]
        },
        "client_interop": {
          "verdict": "pass",
          "reason_tags": [],
          "observed_tags": [
            "envelope-absent"
          ]
        },
        "discovery": {
          "verdict": "fail",
          "reason_tags": [
            "bazaar-extension-absent"
          ],
          "observed_tags": [
            "bazaar-extension-absent"
          ]
        }
      },
      "tool_detail": {
        "grade": "A",
        "bazaar_ready": false,
        "blockers": [
          "V2_BAZAAR_PRESENT"
        ],
        "checks_run": 41,
        "findings": [
          {
            "code": "V2_BAZAAR_PRESENT",
            "severity": "error",
            "core": false,
            "regime": "bazaar",
            "tag": "bazaar-extension-absent",
            "provenance": [
              {
                "kind": "cdp-validator",
                "ref": "cdp-validator-toolshed.json preflight[15] has_bazaar_extension (required)"
              },
              {
                "kind": "spec",
                "ref": "specs/extensions/bazaar.md:512-517 § Client Behavior — omitting the extension means no cataloging"
              },
              {
                "kind": "field-report",
                "ref": "x402-foundation/x402#3045 — a CDP engineer: `extensions.bazaar.discoverable` is \"not a valid field\""
              }
            ],
            "decides": [
              "discovery"
            ],
            "could_decide": [
              "discovery"
            ],
            "message": "extensions.bazaar is absent — this resource is payable but not discoverable."
          },
          {
            "code": "V1_ABSENT",
            "severity": "info",
            "core": false,
            "regime": "payment",
            "tag": "envelope-absent",
            "provenance": [
              {
                "kind": "client-code",
                "ref": "x402-fetch@1.2.0 dist/esm/index.mjs:22 — the v1 client reads the body and never looks at PAYMENT-REQUIRED"
              },
              {
                "kind": "field-report",
                "ref": "x402-foundation/x402#3091 — the pre-header buyer population is real and shrinking"
              },
              {
                "kind": "cdp-validator",
                "ref": "cdp-validator-toolshed.json preflight[4] valid_json (required) — an EMPTY 402 body fails it, so serve at least `{}`"
              }
            ],
            "decides": [],
            "could_decide": [
              "client_interop"
            ],
            "message": "the 402 body carries no x402 v1 envelope — this endpoint publishes v2 only."
          },
          {
            "code": "V1_BODY_NOT_ENVELOPE",
            "severity": "info",
            "core": false,
            "regime": "payment",
            "tag": "envelope-absent",
            "provenance": [
              {
                "kind": "spec",
                "ref": "specs/transports-v2/http.md:172-174 § Response Body (\"Response bodies are a server implementation concern\")"
              },
              {
                "kind": "spec",
                "ref": "specs/transports-v2/http.md:19-25 — the spec’s own 402 example serves a body of `{}`"
              },
              {
                "kind": "client-code",
                "ref": "x402-fetch@1.2.0 dist/esm/index.mjs:22-23 — an error blob makes accepts undefined and .map throws"
              },
              {
                "kind": "cdp-validator",
                "ref": "cdp-validator-toolshed.json preflight[4] valid_json (required) — the body is parsed as JSON during indexing"
              }
            ],
            "decides": [],
            "could_decide": [
              "payment",
              "client_interop"
            ],
            "message": "the 402 body is {} — JSON, but not an x402 envelope."
          }
        ]
      }
    },
    {
      "id": "calibration-live-positive-control",
      "dimensions": {
        "payment": {
          "verdict": "pass",
          "reason_tags": [],
          "observed_tags": []
        },
        "client_interop": {
          "verdict": "pass",
          "reason_tags": [],
          "observed_tags": []
        },
        "discovery": {
          "verdict": "pass",
          "reason_tags": [],
          "observed_tags": []
        }
      },
      "tool_detail": {
        "grade": "A",
        "bazaar_ready": true,
        "blockers": [],
        "checks_run": 77,
        "findings": []
      }
    },
    {
      "id": "calibration-bazaar-spec-example",
      "dimensions": {
        "payment": {
          "verdict": "pass",
          "reason_tags": [],
          "observed_tags": [
            "envelope-absent"
          ]
        },
        "client_interop": {
          "verdict": "pass",
          "reason_tags": [],
          "observed_tags": [
            "envelope-absent"
          ]
        },
        "discovery": {
          "verdict": "pass",
          "reason_tags": [],
          "observed_tags": []
        }
      },
      "tool_detail": {
        "grade": "A",
        "bazaar_ready": true,
        "blockers": [],
        "checks_run": 53,
        "findings": [
          {
            "code": "V1_ABSENT",
            "severity": "info",
            "core": false,
            "regime": "payment",
            "tag": "envelope-absent",
            "provenance": [
              {
                "kind": "client-code",
                "ref": "x402-fetch@1.2.0 dist/esm/index.mjs:22 — the v1 client reads the body and never looks at PAYMENT-REQUIRED"
              },
              {
                "kind": "field-report",
                "ref": "x402-foundation/x402#3091 — the pre-header buyer population is real and shrinking"
              },
              {
                "kind": "cdp-validator",
                "ref": "cdp-validator-toolshed.json preflight[4] valid_json (required) — an EMPTY 402 body fails it, so serve at least `{}`"
              }
            ],
            "decides": [],
            "could_decide": [
              "client_interop"
            ],
            "message": "the 402 body carries no x402 v1 envelope — this endpoint publishes v2 only."
          },
          {
            "code": "V1_BODY_NOT_ENVELOPE",
            "severity": "info",
            "core": false,
            "regime": "payment",
            "tag": "envelope-absent",
            "provenance": [
              {
                "kind": "spec",
                "ref": "specs/transports-v2/http.md:172-174 § Response Body (\"Response bodies are a server implementation concern\")"
              },
              {
                "kind": "spec",
                "ref": "specs/transports-v2/http.md:19-25 — the spec’s own 402 example serves a body of `{}`"
              },
              {
                "kind": "client-code",
                "ref": "x402-fetch@1.2.0 dist/esm/index.mjs:22-23 — an error blob makes accepts undefined and .map throws"
              },
              {
                "kind": "cdp-validator",
                "ref": "cdp-validator-toolshed.json preflight[4] valid_json (required) — the body is parsed as JSON during indexing"
              }
            ],
            "decides": [],
            "could_decide": [
              "payment",
              "client_interop"
            ],
            "message": "the 402 body is {} — JSON, but not an x402 envelope."
          }
        ]
      }
    },
    {
      "id": "calibration-cloudflare-batch-settlement",
      "dimensions": {
        "payment": {
          "verdict": "pass",
          "reason_tags": [],
          "observed_tags": [
            "network-form",
            "network-unknown",
            "timeout-form"
          ]
        },
        "client_interop": {
          "verdict": "pass",
          "reason_tags": [],
          "observed_tags": [
            "envelope-absent"
          ]
        },
        "discovery": {
          "verdict": "fail",
          "reason_tags": [
            "network-unsupported-by-provider",
            "bazaar-extension-absent"
          ],
          "observed_tags": [
            "network-unsupported-by-provider",
            "discovery-metadata",
            "bazaar-extension-absent"
          ]
        }
      },
      "tool_detail": {
        "grade": "A",
        "bazaar_ready": false,
        "blockers": [
          "V2_NETWORK_SUPPORTED",
          "V2_BAZAAR_PRESENT"
        ],
        "checks_run": 35,
        "findings": [
          {
            "code": "V2_NETWORK_CAIP2_STYLE",